{
  "id": "faq-section-example",
  "type": "wireframe",
  "label": "FAQ Section Example",
  "version": "0.1.0",
  "root": {
    "id": "faq-section",
    "type": "section",
    "label": "Frequently Asked Questions",
    "children": [
      {
        "id": "faq-heading",
        "type": "heading",
        "label": "FAQ Heading",
        "role": "headline"
      },
      {
        "id": "faq-accordion",
        "type": "accordion",
        "label": "FAQ Accordion",
        "state": "collapsed"
      }
    ]
  },
  "responsive": {
    "desktop": "Accordion is centered in a constrained content column.",
    "tablet": "Accordion remains single column.",
    "mobile": "Accordion items use full-width tap targets."
  }
}
