{
  "id": "feature-grid-section-example",
  "type": "wireframe",
  "label": "Feature Grid Section Example",
  "version": "0.1.0",
  "root": {
    "id": "feature-grid-section",
    "type": "section",
    "label": "Feature Grid Section",
    "layout": "featureGrid",
    "children": [
      {
        "id": "section-heading",
        "type": "heading",
        "label": "Section Heading",
        "role": "headline"
      },
      {
        "id": "feature-grid",
        "type": "cardGrid",
        "label": "Feature Grid",
        "children": [
          {
            "id": "feature-card-one",
            "type": "card",
            "label": "Feature Card One"
          },
          {
            "id": "feature-card-two",
            "type": "card",
            "label": "Feature Card Two"
          },
          {
            "id": "feature-card-three",
            "type": "card",
            "label": "Feature Card Three"
          }
        ]
      }
    ]
  },
  "responsive": {
    "desktop": "Cards use a three-column grid.",
    "tablet": "Cards reduce to two columns.",
    "mobile": "Cards stack in one column."
  }
}
